{"schema_version":"pysolate.run-comparison.v1","source_sha256":"sha256:a3f79f0fd90f44d704bd73be4d7fae6a59da41124773766cfd4ed99ae9f84e96","generated_at_policy":"omitted","comparison_id":"comparison-incomplete","left_run_id":"run-incomplete-parent","right_run_id":"run-incomplete","same_dimensions":["artifact","profile","workload"],"different_dimensions":[],"call_deltas":[],"workspace_deltas":[],"reason_codes":["no_difference"],"page":{"cursor":"","next_cursor":"","returned":0,"total":0,"truncated":false}}