{"schema_version":"pysolate.run-comparison.v1","source_sha256":"sha256:c66194cbfcb5bfc6183e88f4d2cdb976265ea99cabcea0a8d9b8f7146e85fec6","generated_at_policy":"omitted","comparison_id":"comparison-branched","left_run_id":"run-branched-parent","right_run_id":"run-branched","same_dimensions":["artifact","profile","workload"],"different_dimensions":["capability_calls","result","workspace"],"call_deltas":[{"operation_index":0,"kind":"changed","left_sha256":"sha256:6e6e77a761497152e2e055fa3420914e46d35658cd4101fde790a10437f917ea","right_sha256":"sha256:4207a20960d90abe097c1fc5676146f3cd3a4bf8d9a7659cc985d462c648b2cb"}],"workspace_deltas":[{"path":"reports/result.json","kind":"modified"}],"reason_codes":["capability_result_changed","workspace_digest_changed"],"page":{"cursor":"","next_cursor":"","returned":2,"total":2,"truncated":false}}