{"schema_version":"pysolate.run-comparison.v1","source_sha256":"sha256:3222d98ecec889b156cb3d3919390363150eef947cc361ff5b4d62be7fefc338","generated_at_policy":"omitted","comparison_id":"comparison-ordinary","left_run_id":"run-ordinary-parent","right_run_id":"run-ordinary","same_dimensions":["artifact","profile","workload"],"different_dimensions":[],"call_deltas":[],"workspace_deltas":[],"reason_codes":["no_difference"],"page":{"cursor":"","next_cursor":"","returned":0,"total":0,"truncated":false}}