{"schema_version":"pysolate.run-comparison.v1","source_sha256":"sha256:96471d39c04f3382696a858021bcb83f675f274a6d7de1f2450057e82beec71a","generated_at_policy":"omitted","comparison_id":"comparison-private","left_run_id":"run-private-parent","right_run_id":"run-private","same_dimensions":["artifact","profile","workload"],"different_dimensions":[],"call_deltas":[],"workspace_deltas":[],"reason_codes":["no_difference"],"page":{"cursor":"","next_cursor":"","returned":0,"total":0,"truncated":false}}